{
  "$schema": "https://json-schema.org/draft/2020-12/schema",
  "$id": "tenra-partition.lab-validation-request.v1",
  "title": "Partition lab validation request",
  "type": "object",
  "additionalProperties": true,
  "required": [
    "schema",
    "exportedAt",
    "source",
    "requestedExpansionBytes",
    "plan",
    "simulation",
    "execution"
  ],
  "properties": {
    "schema": {
      "const": "tenra-partition.lab-validation-request.v1",
      "type": "string"
    },
    "exportedAt": {
      "type": "string"
    },
    "source": {
      "type": "object"
    },
    "requestedExpansionBytes": {
      "type": "number"
    },
    "plan": {
      "type": "object"
    },
    "simulation": {
      "type": "object"
    },
    "execution": {
      "type": "object"
    }
  },
  "x-tenra": {
    "ownerApp": "partition",
    "producerApp": "partition",
    "consumerApps": [
      "lab validation",
      "guardrail"
    ],
    "fixture": "tenra Partition/fixtures/handoffs/lab-validation-request.json",
    "correlationFields": [
      "source.id"
    ],
    "standardControls": [
      "schema badge",
      "preview payload",
      "download JSON",
      "import history"
    ]
  }
}
